"id","worldorg","sex","name","country_id/id"
"campos_event.campos_scout_org_1635","WAGGGS","girls-only","The Ghana Girl Guides Association","base.gh"
"campos_event.campos_scout_org_1634","WOSM","both","The Ghana Scout Association","base.gh"
"campos_event.campos_scout_org_1556","WAGGGS","girls-only","The Girl Guide Association of Barbados","base.bb"
"campos_event.campos_scout_org_1539","WAGGGS","girls-only","The Girl Guides Association of Antigua and Barbuda","base.ag"
"campos_event.campos_scout_org_1552","WAGGGS","girls-only","The Girl Guides Association of Bahrain","base.bh"
"campos_event.campos_scout_org_1562","WAGGGS","girls-only","The Girl Guides Association of Belize","base.bz"
"campos_event.campos_scout_org_1609","WAGGGS","girls-only","The Girl Guides Association of Dominica","base.dm"
"campos_event.campos_scout_org_1639","WAGGGS","girls-only","The Girl Guides Association of Grenada","base.gd"
"campos_event.campos_scout_org_1667","WAGGGS","girls-only","The Girl Guides Association of Jamaica","base.jm"
"campos_event.campos_scout_org_1676","WAGGGS","girls-only","The Girl Guides Association of Kiribati","base.ki"
"campos_event.campos_scout_org_1720","WAGGGS","girls-only","The Girl Guides Association of Namibia","base.na"
"campos_event.campos_scout_org_1766","WAGGGS","girls-only","The Girl Guides Association of Saint Christopher and Nevis","base.kn"
"campos_event.campos_scout_org_1812","WAGGGS","girls-only","The Girl Guides Association of Thailand","base.th"
"campos_event.campos_scout_org_1816","WAGGGS","girls-only","The Girl Guides Association of the Kingdom of Tonga","base.to"
"campos_event.campos_scout_org_1786","WAGGGS","girls-only","The Girl Guides Association of the Solomon Islands","base.sb"
"campos_event.campos_scout_org_1818","WAGGGS","girls-only","The Girl Guides Association of Trinidad and Tobago","base.tt"
"campos_event.campos_scout_org_1595","WAGGGS","girls-only","The Girl Guides Cook Islands Association","base.ck"
"campos_event.campos_scout_org_1673","WOSM","both","The Kenya Scouts Association","base.ke"
"campos_event.campos_scout_org_1698","WAGGGS","girls-only","The Malawi Girl Guides Association","base.mw"
"campos_event.campos_scout_org_1704","WAGGGS","girls-only","The Malta Girl Guides Association","base.mt"
"campos_event.campos_scout_org_1708","WAGGGS","girls-only","The Mauritius Girl Guides Association","base.mu"
"campos_event.campos_scout_org_1707","WOSM","both","The Mauritius Scout Association","base.mu"
"campos_event.campos_scout_org_1735","WOSM","both","The National Organisation for Scouts and Guides","base.om"
"campos_event.campos_scout_org_1736","WAGGGS","both","The National Organisation for Scouts and Guides","base.om"
"campos_event.campos_scout_org_1811","WOSM","both","The National Scout Organization of Thailand","base.th"
"campos_event.campos_scout_org_1732","WAGGGS","girls-only","The Nigerian Girl Guides Association","base.ng"
"campos_event.campos_scout_org_1767","WOSM","both","The Saint Lucia Scout Association","base.lc"
"campos_event.campos_scout_org_1755","WAGGGS","both","The Scout and Guide Association of Qatar","base.qa"
"campos_event.campos_scout_org_1754","WOSM","both","The Scout and Guide Association of Qatar","base.qa"
"campos_event.campos_scout_org_1829","WOSM","both","The Scout Association","base.uk"
"campos_event.campos_scout_org_1561","WOSM","both","The Scout Association of Belize","base.bz"
"campos_event.campos_scout_org_1608","WOSM","both","The Scout Association of Dominica","base.dm"
"campos_event.campos_scout_org_1638","WOSM","both","The Scout Association of Grenada","base.gd"
"campos_event.campos_scout_org_1644","WOSM","both","The Scout Association of Guyana","base.gy"
"campos_event.campos_scout_org_1650","WOSM","both","The Scout Association of Hong Kong","base.hk"
"campos_event.campos_scout_org_1666","WOSM","both","The Scout Association of Jamaica","base.jm"
"campos_event.campos_scout_org_1697","WOSM","NA","The Scout Association of Malawi","base.mw"
"campos_event.campos_scout_org_1701","WOSM","both","The Scout Association of Maldives","base.mv"
"campos_event.campos_scout_org_1703","WOSM","both","The Scout Association of Malta","base.mt"
"campos_event.campos_scout_org_1742","WOSM","boys only","The Scout Association of Papua New Guinea","base.pg"
"campos_event.campos_scout_org_1769","WOSM","both","The Scout Association of Saint Vincent and the Grenadines","base.vc"
"campos_event.campos_scout_org_1813","WOSM","both","The Scout Association of the Bahamas","base.bs"
"campos_event.campos_scout_org_1817","WOSM","both","The Scout Association of Trinidad and Tobago","base.tt"
"campos_event.campos_scout_org_1852","WOSM","both","The Scout Association Scotland","base.uk"
"campos_event.campos_scout_org_1779","WAGGGS","girls-only","The Sierra Leone Girl Guides Association","base.sl"
"campos_event.campos_scout_org_1780","WOSM","both","The Singapore Scout Association","base.sg"
"campos_event.campos_scout_org_1795","WAGGGS","girls-only","The Sri Lanka Girl Guides Association","base.lk"
"campos_event.campos_scout_org_1797","WAGGGS","girls-only","The Sudan Girl Guides Association","base.sd"
"campos_event.campos_scout_org_1801","WAGGGS","girls-only","The Swaziland Girl Guides Association","base.sz"
"campos_event.campos_scout_org_1810","WAGGGS","girls-only","The Tanzania Girl Guides Association","base.tz"
"campos_event.campos_scout_org_1824","WAGGGS","girls-only","The Uganda Girl Guides Association","base.ug"
"campos_event.campos_scout_org_1823","WOSM","both","The Uganda Scouts Association","base.ug"
"campos_event.campos_scout_org_1821","WOSM","both","Türkiye ?zcilik Federasyonu","base.tr"
"campos_event.campos_scout_org_1822","WAGGGS","both","Türkiye ?zcilik Federasyonu","base.tr"
"campos_event.campos_scout_org_1571","WOSM","both","União dos Escoteiros do Brasil","base.br"
"campos_event.campos_scout_org_1594","WOSM","both","Wezombeli","base.km"
"campos_event.campos_scout_org_1838","WAGGGS","girls-only","Yemen Scouts and Guides Association - Guide branch","base.ye"
"campos_event.campos_scout_org_1837","WOSM","boys only","Yemen Scouts and Guides Association - Scout branch","base.ye"
"campos_event.campos_scout_org_1839","WOSM","both","Zambia Scouts Association","base.zm"
"campos_event.campos_scout_org_1785","WAGGGS","both","Združenje slovenskih katoliških skavtinj in skavtov","base.si"
"campos_event.campos_scout_org_1784","WOSM","both","Zveza tabornikov Slovenije","base.si"
"campos_event.campos_scout_org_1750","WOSM","both","Zwi?zek Harcerstwa Polskiego","base.pl"
"campos_event.campos_scout_org_1751","WAGGGS","both","Zwi?zek Harcerstwa Polskiego","base.pl"
